{
  "manifest_version": 1,
  "id": "01905c5e-0000-7000-8000-11a7c3d90003",
  "version": "0.1.0",
  "kind": "adapter",
  "runtime": {
    "type": "process",
    "entrypoint": "acp-loop",
    "language": "rust"
  },
  "implements": [
    "agent_loop@1"
  ],
  "requested_capabilities": {
    "process": [
      "spawn_acp_agent"
    ]
  }
}
